Name,Description,Duration,Year,Type
"Lucky, el elefante de la suerte","Un chico huérfano tiene como mejor amigo a un elefante, con el cual emprendió un viaje dispuestos a buscar el éxito.","1 horas, 49 minutos",2013,movie
El Septimo Enanito,"Cuando Bobo, el más joven de los siete enanitos, pica accidentalmente a la princesa Rose (también conocida como la Bella Durmiente) y envía al reino a un sueño de un siglo, Bobo y los otros seis enanitos deben viajar al futuro para revivir a Rose.","1 horas, 43 minutos",2013,movie
Wizard of Oz,"Acompaña a Dorothy en su increíble viaje a través de Oz con nuevos amigos, el espantapájaros, el hombre de hojalata y el león, en busca de las puertas doradas y el hogar al que realmente pertenece.","0 horas, 31 minutos",2005,movie
Cinderella,"Cenicienta sirve a sus hermanastras hasta que su hada madrina la lleva al baile. Enamorada del príncipe, debe apresurarse antes de que el hechizo desaparezca. El príncipe busca por el reino y viven felices para siempre","0 horas, 30 minutos",2004,movie
Snow White,"Blancanieves escapa de su celosa madrastra y vive con siete enanitos en el bosque. La Reina malvada la envenena, sumiéndola en un sueño sin tiempo. Un príncipe fiel la despierta con un beso, rompiendo el hechizo maligno.""","0 horas, 32 minutos",2007,movie
Sleeping Beauty,"Buenas hadas y la malvada bruja Úrsula ofrecen regalos a la princesita. Úrsula lanza una maldición de cien años. Un valiente príncipe rompe el hechizo con un beso, despertando a la princesa del largo sueño.""","0 horas, 29 minutos",2004,movie
Atlantis,"Explora la ciudad perdida de Atlantis, su poder y su inevitable destrucción. La princesa Elan se enamora de Terra y, tras la muerte de la Reina a manos de Belial, busca salvar a su pueblo recuperando los cristales del aire, agua, tierra y fuego.","1 horas, 1 minutos",2004,movie
Chihuahua: La Película,Una mujer malhumorada y recientemente divorciada se ve obligada a cambiar sus prioridades cuando se despierta en el cuerpo de una Chihuahua llamada Bella que visita a los niños enfermos en un hospital donde ella es un perro terapéutico.,"1 horas, 44 minutos",2010,movie
Mi Amigo Ninja,Una muñeca Ninja poseída se une a un adolescente para vengar el asesinato de un niño.,"1 horas, 35 minutos",2018,movie
Mi Pequeño Mono,"Deportado de China, un mono muy especial llega a Suecia y es adoptado por una familia que ni siquiera sospecha que el animal es mucho más inteligente de lo normal y se mete en muchos problemas.","1 horas, 46 minutos",2017,movie
Una prueba de fe,John y Alexa Taylor parecen tener la vida perfecta. Son la envidia de todos los padres de la ciudad. Su hijo Beau es la estrella del fútbol de la escuela y su hija Ravyn es la estudiante número uno.,"1 horas, 43 minutos",2019,movie
Edhel,Edhel tiene una malformación en las orejas que parecen las de un elfo. Afronta su malestar evitando relacionarse con la gente. El encuentro un extraño conserje de la escuela convence a la niña de pertenecer a la noble línea de los Elfos.,"1 horas, 39 minutos",2016,movie
The Enchanted Cave,"La película cuenta una historia sobre la esperanza, pero también sobre la codicia humana.  Un emocionante cuento de hadas lleno de suspense arrastra al espectador a las profundidades de una misteriosa cueva hasta que no quiere salir a la superficie.","1 horas, 55 minutos",2020,movie
The Graciuos Ghost,"La historia, basada en el cuento de Hans Christian Andersen El polvorín. Voita adquiere un polvorín de oro con el que puede conjurar al fantasma y pedirle que cumpla tres deseos.","1 horas, 49 minutos",2020,movie
Cómo no casarse con una princesa,"Tras el nacimiento del príncipe, tres Parcas predicen una profecía. Un cuento de hadas sobre viajes en el tiempo, cambiar el curso del destino y descubrir que una profecía puede ser la mayor de las bendiciones.","1 horas, 46 minutos",2020,movie
La locura de la historia,"Atti, un adolescente romano inteligente e ingenioso, logra molestar al emperador Nerón con uno de sus planes.","1 horas, 50 minutos",2019,movie
El Gran Cambio,"Una familia al borde del colapso se encuentra atrapada en el cuerpo del otro. ""Freaky Friday"" va a la iglesia, en esta sentida comedia familiar.","1 horas, 46 minutos",2018,movie
The Ghost Club,"Un grupo de niños descubre a un fantasma amistoso llamado Carolyn, que acecha en un bosque cercano, y trata de idear un plan para capturarla.","1 horas, 41 minutos",2002,movie
¿Y dónde está el piloto? II,"Hay un loco bombardero a bordo, el primer trasbordador a la luna está por auto-destruirse, los motores no están funcionado, y lo peor de todo, la tripulación del vuelo descubre que están ¡completamente locos!","1 horas, 40 minutos",1981,movie
¿Y dónde está el piloto?,"Considerada ""una de las 10 películas más divertidas de la historia"" por el American Film Institute, ""¿Y dónde está el piloto?"" es una obra maestra de la comedia de disparate.","1 horas, 43 minutos",1979,movie
El Mundo Según Wayne,"En la tradición de LOS DIEZ MANDAMIENTOS, LAWRENCE DE ARABIA, y GANDHI llega un poema épico lleno de espectáculo y drama.","1 horas, 52 minutos",1991,movie
El Mundo según Wayne 2,"Los dos roqueros favoritos de Aurora, Illinois, están de vuelta en esta secuela de la comedia de 1992, El mundo de Wayne.","1 horas, 52 minutos",1992,movie
The Four 1,"Un departamento del gobierno conocido como Six Panels nombra a su mejor oficial para infiltrarse en una fuerza especial llamada Divine Constabulary, para asegurarse de detener la circulación de monedas falsas en la capital.","2 horas, 18 minutos",2011,movie
The Four 2,"Cuatro detectives, cada uno con poderes sobrenaturales, dedican sus habilidades únicas y especiales a resolver crímenes y detener a poderosos criminales.","2 horas, 17 minutos",2012,movie
The Four 3,"Un escuadrón de élite sale a resolver el misterio del emperador Huizong, desaparecido tras un atentado contra su vida.","2 horas, 6 minutos",2013,movie
War of the Worlds,"En esta nueva versión moderna del clásico horror de ciencia ficción de H.G. Wells, la civilización se arruina cuando una súper raza de extraterrestre invade la Tierra.","1 horas, 45 minutos",2004,movie
War of the Worlds 2: The Next Wave,"Dos años después de la invasión marciana, se dan cuenta de los peores temores de George Herbert: han regresado.","1 horas, 45 minutos",2007,movie
3 A.M.,"Todas las historias tienen lugar a las 3 am, la hora más aterradora de la noche, ya que es el momento en que los espíritus son libres para vagar libremente.","1 horas, 53 minutos",2019,movie
3 A.M. 2 : La hora de la muerte,"Basado en la creencia de que las 3 am es el momento en que el mundo de los muertos y los vivos chocan, sigue 3 historias de terror:","2 horas, 2 minutos",2019,movie
La Invocación,Akane es una maestra que escucha de sus alumnos el rumor de que hay imágenes de alguien suicidándose en Internet. Estas imágenes llevan a quienes también las ven a suicidarse.,"1 horas, 54 minutos",2019,movie
La Invocación 2,"Pasaron muchos años después de los misteriosos y terribles hechos provocados por una cinta de vídeo maldita, que provocó la muerte de varias personas.","1 horas, 54 minutos",2019,movie
Las Guerras Inmortales,"Después de que una guerra catastrófica sume al mundo en el caos, surge una nueva raza de seres con superpoderes conocidos como ""desviados"".","1 horas, 50 minutos",2017,movie
Las guerras inmortales 2: Resurgimiento,La guerra por la libertad acaba de comenzar. Trikalypse une fuerzas con el líder rebelde y un equipo de luchadores por la libertad para acabar con Dominion y exponer su malvada corporación al mundo.,"2 horas, 12 minutos",2020,movie
Las Guerras inmortales: Renacimiento,"Rebirth tiene lugar durante las primeras etapas brutales de Dominion Industries. En esta historia, Olive y otros desviados se someten a una serie de experimentos mortales dirigidos por Laurie Harvey y su equipo.","1 horas, 40 minutos",2020,movie
Hada de dientes,"Los adultos de una pequeña comunidad agrícola se reúnen, comienzan a darse cuenta de que el hada de los dientes malditos, que los traumatizó en su juventud, está suelta de nuevo. ¡Esta vez, viniendo tras sus hijos!","1 horas, 41 minutos",2019,movie
Hada de dientes: la raiz del mal,"20 años después de ser aterrorizada por el Hada de los Dientes, Corey comienza a sospechar que ha regresado para terminar el trabajo.","1 horas, 49 minutos",2020,movie
Hada de los dientes: la última extracción,"Corey y su hija, Sally, decidieron irse de vacaciones de verano con sus amigos, Diane, Christy, Toby y Benny. Poco saben, el pasado de Corey lo alcanzará.","1 horas, 51 minutos",2021,movie
"Inuyasha, The Castle beyond the looking Glass","Después de que los héroes aparentemente derrotan a Naraku; Inuyasha, Kagome y Shippo están separados de Miroku y Sango. Kagura y Kanna se encuentran con Kaguya, la Princesa de los Cielos, sellada en un espejo.","1 horas, 57 minutos",2003,movie
"Inuyasha, Fire in the Mystic Island","En la Isla Horai, una mujer que se parece a Kikyō, deja caer una esfera verde al Caldero de Resonancia. Libera a los cuatro dioses de la guerra y las cicatrices aparecen en el resto de los niños medio demonio.","1 horas, 42 minutos",2001,movie
"Inuyasha, Swords of an Honorble ruler","En el actual Tokio, la familia de Kagome envía una espada al almacén. Resulta ser So'unga, rompe el hechizo de setecientos años del espíritu de la vaina, Saya. Cuando Inuyasha toca la espada, la posee y la trae de vuelta al pasado.","1 horas, 55 minutos",2002,movie
Inuyasha The Movie: Affections touching across time,"El padre de Inuyasha derrotó a una poderosa polilla yōkai china llamada Hyōga, hace quinientos años. El fragmento de Joya Shikon revive a su hijo, Menōmaru, y a sus fieles sirvientes, Ruri y Hari (que planean vengar a su familia).","1 horas, 58 minutos",2000,movie
The Naples Heist,"Cada uno de ellos es un maestro en su especialidad, cinco hombres intentan llevar a cabo el mayor robo de sus vidas: el Banco de Nápoles.","1 horas, 46 minutos",2014,movie
Peleador misterioso - Proyecto A,"Un joven es golpeado y no puede recordar quién es, pero pronto descubre que tiene dos habilidades significativas. Él sabe mucho sobre cocinar, y es un hábil artista marcial.","1 horas, 59 minutos",2018,movie
La Última Pelea,"Un ex campeón de lucha NCAA está en libertad condicional después de 10 años de prisión. Ahora, para salvar la vida de un amigo, acepta participar en combates extremos. Sin embargo, se le pide que haga lo imposible: perder.","1 horas, 51 minutos",2012,movie
La Trampa,"Un grupo de amigos planea con éxito el robo de unos diamantes, pero no cuentan con que uno de ellos los traicionará.","1 horas, 40 minutos",2010,movie
Cuenta regresiva,Las superestrellas de WWE Dolph Ziggler y Kane lideran la acción en esta electrizante y emocionante película de suspenso.,"1 horas, 46 minutos",2016,movie
El sustituto 4,Encubierto y en peligro: Treat Williams encarna a un policía que se hace pasar por profesor en una escuela militar de élite amenazada desde adentro por neonazis clandestinos.,"1 horas, 49 minutos",2001,movie
Stretch,Un desafortunado conductor de limusina lucha por seguir adelante y pagar una deuda con su corredor de apuestas. Toma un trabajo con un pasajero enloquecido cuyo libro buscado implica a algunos criminales muy peligrosos.,"1 horas, 52 minutos",2013,movie
El sustituto,"Una maestra es atacada por los miembros de una pandilla de la escuela, así que su novio un soldado cazafortunas,  Shale, decide tomar el asunto en sus propias manos. Este se convierte en el nuevo maestro suplente y trabaja de encubierto para investigar","2 horas, 13 minutos",1996,movie
Thunder of War,"En noviembre de 1941, un escuadrón restante de soldados soviéticos debe detener una columna de tanques alemanes nazis.","2 horas, 21 minutos",2015,movie
Bienvenido a la Jungla,Un empleado que es víctima del bullying debe dar rienda suelta a su bestia interior después de que un retiro de trabajo en equipo en la jungla sale mal.,"1 horas, 52 minutos",2013,movie
Nacido para correr,"Born To Race es la historia de Danny Krueger, un joven corredor callejero rebelde en un curso de colisión con problemas.","1 horas, 52 minutos",2010,movie
Acorralados,"Una banda de ladrones que huye tras atracar un banco se topa con una familia que se encuentra de acampada. Aprovechando la ocasión, los criminales esconderán el dinero robado en su coche mientras éstos descansan","1 horas, 44 minutos",2012,movie
Contrario de Sangre,"Dimitri y James, dos poderosos asesinos de élite a sueldo del gobierno, se reencuentran después de su último trabajo en el sudeste asiático.","1 horas, 42 minutos",2017,movie
Luna Llena,Un pistolero del salvaje oeste regresa de la tumba para evitar que una banda de hombres lobo sedientos de sangre aterrorice a un pequeño pueblo.,"1 horas, 50 minutos",2018,movie
Balas Voladoras,"Durante un período de batallas entre señores de la guerra en el sur de China, se producen varios asesinatos en una fábrica de municiones. Con un detalle: las balas desaparecen. Un detective y su compañero, un experto tirador, inician la investigación.","2 horas, 7 minutos",2011,movie
Los Guerreros,"Los ejércitos de la noche tienen 100.000 hombres. Superan a la policía en 5 a 1. Y esta noche, van por los Warriors.","1 horas, 51 minutos",1978,movie
Conectado,"Un cobrador de deudas recibe una llamada de una mujer que es secuestrada por una pandilla desconocida. Él piensa que es una broma, pero pronto se da cuenta de que no es una broma.","2 horas, 10 minutos",2007,movie
El Amuleto Sagrado,"Cuando una valiosa cuenta es robada por miembros renegados del misterioso Clan Géminis, los protectores de la cuenta recurren a la ayuda de algunos antiguos miembros para recuperarla y llevar a los malvados discípulos ante la justicia.","2 horas, 0 minutos",2006,movie
Operación Overlord,"Una semana antes de asaltar las playas de Normandía, dos soldados estadounidenses se infiltran en un complejo abandonado para rescatar a un prisionero de guerra de las garras del régimen nazi.","1 horas, 36 minutos",2021,movie
Big game,Un joven que está acampando en el bosque ayuda a rescatar al Presidente de los Estados Unidos cuando el Air Force One es derribado cerca de donde está su camping.,"1 horas, 46 minutos",1969,movie
End of a Gun,"Un guardia de seguridad del centro comercial, y ex-agente federal, se cruza con el ejecutor de un narcotraficante después de que salva a una mujer del peligro.","1 horas, 42 minutos",2015,movie
Killing Down,"Es 1993. Siete años después de que sucediera. Pero Steven Down no puede dejarlo pasar. Es un hombre paranoico, preocupado y desordenado. Un veterano del ejército de los EE. UU. Que busca la verdad.","2 horas, 9 minutos",2020,movie
Shinjuku Incident,Un simple inmigrante chino libra una peligrosa guerra contra una de las organizaciones criminales más poderosas del planeta.,"2 horas, 19 minutos",2008,movie
RedBad La Invasión de los Francos,"Cuando el monje Bonifatius es asesinado en una ciudad holandesa llamada Dokkum, la sospecha recae sobre los guerreros bárbaros. asesinados a sangre fría, ¿o es sólo la forma cristiana de ver la historia?","3 horas, 6 minutos",2017,movie
Ataque de Los Zombis,Un empleado mediocre de un fabricante de armas debe sobrevivir al caos dentro de la oficina cuando sus colegas se convierten en maníacos asesinos después de tomar una bebida misteriosa.,"1 horas, 44 minutos",2017,movie
La Invasión – Ocupación Alienígena,"Dos años después de que los extraterrestres aterrizaran en la Tierra, los sobrevivientes de Sydney, Australia, luchan en una guerra desesperada mientras el número de muertos continúa aumentando. Una última batalla es la esperanza de la humanidad.","2 horas, 30 minutos",2021,movie
La Colonia,"Bajo la superficie helada, los sobrevivientes de la Colonia 7 luchan mientras los alimentos y las temperaturas bajan. Luego de una expedición descubren una amenaza peor de lo imaginado.","1 horas, 52 minutos",2013,movie
La Invasión,"Algunos residentes de la ciudad tienen que unirse después de una devastadora invasión alienígena. Mientras luchan por sobrevivir, se dan cuenta de que deben ir un paso por delante de sus atacantes.","2 horas, 19 minutos",2018,movie
El imperio prohibido,"Principios del siglo 18. El cartógrafo Cartographer Jonathan Green emprende un viaje científico por Europa hacia el este. Luego de pasar por Transilvania y habiendo cruzado los Montes Cárpatos, se encuentra en una pequeña villa perdida en los bosques.","2 horas, 11 minutos",2015,movie
Planetarium,"""Planetarium"" sigue el viaje de hermanas que se cree que poseen la habilidad sobrenatural de conectarse con fantasmas. Se cruzan con un visionario productor francés mientras actúan en París.","2 horas, 8 minutos",2017,movie
Dredd,"Una prostituta convertida en narcotraficante pretende apoderarse de la futurista ciudad de Mega City One. El juez Dredd, el principal miembro de una fuerza policial de élite, es la última esperanza de la ciudad.","1 horas, 54 minutos",2012,movie
Cypher,"Un hombre confiado y desencantado se encuentra trabajando como espía en el peligroso y arriesgado mundo del espionaje corporativo. Rápidamente superándose, se une a una misteriosa mujer fatal.","1 horas, 53 minutos",2001,movie
Barbarella,"El escenario es el planeta Lythion en el año 40000, cuando Barbarella (Jane Fonda) hace un aterrizaje forzoso mientras viaja a través del espacio. Ella actúa como  James Bond en femenino, vence al mal en  formas de robots y monstruos.","1 horas, 56 minutos",1967,movie
Jeruzalem,Dos estadounidenses de vacaciones se unen a un estudiante de antropología en un viaje por Jerusalén al que llegan justo cuando se desata el terrorífico apocalipsis bíblico.,"1 horas, 51 minutos",2014,movie
Titanic II,"En el centenario del viaje original, un moderno y lujoso barco bautizado como ""Titanic 2"" sigue el camino de su homónimo.","1 horas, 45 minutos",2009,movie
Turbo Kid,"Aunque se ambienta en el año 1997, Turbo Kid cuenta la historia de un futuro post-apocalíptico en el que la Tierra ha sido devastada por la lluvia de ácido, y el agua es un bien escaso.","1 horas, 50 minutos",2015,movie
Secuestro Extraterrestre,"La familia McPherson está reunida para la tradicional cena de Acción de Gracias, pero nunca se imaginaron que tendrían unos visitantes extraterrestres. Esta es la historia de una familia desaparecida.","1 horas, 46 minutos",1997,movie
Crónicas Mutantes,"En el siglo XXIII, el mayor Mitch Hunter (Jane) lidera una lucha contra un ejército de necromutantes que habitan en el mundo subterráneo.","2 horas, 11 minutos",2009,movie
Hotel de Dinosaurios,"Una mujer, desesperada por dinero, acepta participar en un programa clandestino de juegos, solo para descubrir que ella y los demás concursantes están siendo cazados por criaturas prehistóricas.","1 horas, 33 minutos",2021,movie
Apocalipsis en Stonehenge,"Cuando un grupo de arqueólogos desentierra un esqueleto humano cerca del monumento histórico de Stonehenge, se encuentra también una antigua máquina escondida bajo tierra.","1 horas, 47 minutos",2009,movie
El Monstruo de Metal,Un satélite ruso se sale de órbita e impacta en la Tierra. Dos hermanos encuentran los restos del artefacto y descubren que contiene una extraña sustancia alienígena que confiere vida al hierro.,"1 horas, 46 minutos",2010,movie
Ogre,Un ogro vicioso gobierna sobre una ciudad que ha estado estancada en el tiempo desde el siglo XIX.,"1 horas, 46 minutos",2007,movie
Ahora estamos solos,"En un futuro no muy lejano, algo dejó al planeta devastado. Durante mucho tiempo, De se considera el último representante de la humanidad. Acostumbrado a la soledad, casi se siente feliz con la tranquilidad de los días.","1 horas, 57 minutos",2020,movie
Santuario: Población Uno,"Un joven idealista; Ethan, se queda buscando a su familia mientras lucha contra los infectados, la milicia Med-Ex y los merodeadores sedientos de sangre, y los fantasmas de su pasado.","1 horas, 32 minutos",2018,movie
Poseidón Rex,"Cuenta como una pequeña isla, cerca de la costa de Belice sufre aterrorizada el ataque de un mortal depredador del pasado remoto del planeta.","1 horas, 35 minutos",2012,movie
Invasión U.F.O.,Un grupo de amigos debe hacer frente a un ataque alienígena en un pequeño pueblo inglés.,"1 horas, 59 minutos",1969,movie
Meteorito,"Después de que un meteorito choca con la Tierra, un ranchero solitario y una joven perdida huyen de mercenarios viciosos.","1 horas, 40 minutos",2021,movie
COMBUSTIÓN HUMANA,"Desde los tiempos bíblicos y hasta el día de hoy, la historia está llena de narraciones desconcertantes sobre la combustión humana espontánea, en la cual, sin razón explicable, un ser humano saludable de pronto se incendia de adentro hacia afuera.","1 horas, 0 minutos",2001,movie
Los Muertos,"El teniente Brian Murphy  deberá formar equipo con Daniel Dembele para enfrentarse y sobrevivir al terrorífico peligro que los acecha, encarnado en una horda de muertos vivientes en el continente africano.","1 horas, 58 minutos",2011,movie
El proyecto supermente,"En Los Ángeles, la tierra comienza a temblar y los edificios se vienen abajo. La gente entra en pánico. Cuando se procede a revisar los daños todo se encuentra como si nada hubiera pasado, excepto por las calles repletas de cadáveres.","1 horas, 44 minutos",2015,movie
20 años no son nada,"Alice trabaja para la revista ""Rebelle"", donde necesita soltarse el pelo para conseguir un ascenso. Cuando Balthazar le devuelve un USB perdido a Alice, la apariencia de salir con alguien de la mitad de su edad la ayuda. ¿Se vuelve real?","1 horas, 46 minutos",2013,movie
El Placer de Su Compañia,"Un chico le propone matrimonio a su novia, que cae muerta. Su mejor amiga intenta que salga con otras mujeres, pero él solo habla de su gran amor muerto.","1 horas, 49 minutos",2005,movie
Sisters & Brothers,Comedia sobre el amor y la disfunción compartida entre cuatro grupos de hermanos.,"1 horas, 42 minutos",2013,movie
Pena Ajena,"Shaun está conforme por ser un surfer brillante, pero desenfocado y haragán, hasta que el día en que descubre una novela por el aclamado autor Martin Skinner.","1 horas, 38 minutos",2001,movie
Un Día para Siempre,"Zazie es invitada a la boda de su mejor amiga. Ella decide hacer todo lo posible para evitar lo que a sus ojos es el error de su vida. Pero cuando se encuentra atrapada en la línea de tiempo de la boda, las cosas se complican.","1 horas, 50 minutos",2020,movie
Clue,Conoce a todos los sospechosos infames y descubre todas sus jugadas bajas. Te encantarán sus actividades viles en tanto los cuerpos y las risas se apilan delante de ti.,"1 horas, 55 minutos",1984,movie
Algunas Mujeres,"En la víspera de su boda, un escritor exitoso viaja por todo el país para encontrarse con ex amantes en un intento de reparar las transgresiones de relaciones pasadas.","1 horas, 45 minutos",2013,movie
The Longshots,"La historia real de Jasmine Plummer, la primera mujer en la historia en jugar al fútbol americano Pop Warner, entrenada por su tío.","1 horas, 53 minutos",2008,movie
Probable Asesino,"Diez años después de su época dorada, Billy Green (Adam Pally) vuelve a su pueblo natal para Día de Acción de Gracias, desesperado por revivir sus glorias pasadas y reconectar con Kara (Rachel Bloom), su exnovia de la secundaria.","1 horas, 57 minutos",2018,movie
El Asalto,"Lo que debería haber sido una escapada romántica se convierte en una divertida debacle tras otra cuando la mujer de Michael lo deja en el desierto, donde un adolescente le roba el auto y lo toman de rehén en un asalto en el Sip and Zip local.","1 horas, 44 minutos",2000,movie
My Big Gay Italian Wedding,"Antonio ha encontrado por fin al amor de su vida, Paolo, con quien vive felizmente en Berlín. Aunque todavía no están seguros de la reacción de sus familias, deciden casarse en Italia, en el pequeño pueblo donde viven los padres de Antonio.","1 horas, 42 minutos",2018,movie
The Champion,"Podría ser cualquier futbolista profesional de 2022. Christian es un futbolista talentoso, imprevisible y rebelde. Tras su última ""metedura de pata"", el presidente de su equipo decide asignarle un tutor personal que le ayude a controlar su temperamento.","2 horas, 10 minutos",2018,movie
El Doctor y Sus Mujeres,"Un guapo ginecólogo (Richard Gere) en medio de una crisis de la mediana edad, tiene dificultades con su familia, así como con su propia vida.","2 horas, 24 minutos",2000,movie
La Vida Oscura del Gran Duque de Corcega,"En 1221, un joven emprende el camino para convertirse en San Francisco de Asís. Mil años después, un arquitecto debe construir un mausoleo para un multimillonario moribundo. Las vidas de estos hombres cambiarán para siempre por una pandemia.","1 horas, 51 minutos",2021,movie
El Deseo de Charlie,"Un veterano militar regresa a casa después de estar ausente por estrés postraumático. Con su nuevo perro, descubre en medio de la Navidad un nuevo propósito en su vida: ayudar a los exmilitares que necesitan ayuda","1 horas, 56 minutos",2020,movie
A Long Way Down,"En la víspera de Año Nuevo en Londres, cuatro extraños se encuentran en el techo de un edificio conocido por los suicidios.","1 horas, 54 minutos",2013,movie
Miss Arizona,La ex-Miss Arizona ahora es un ama de casa atrapada en un matrimonio infeliz hasta que conoce a un grupo de mujeres empoderadas en un refugio para mujeres.,"1 horas, 52 minutos",2017,movie
Ping Pong en el Verano,Unas vacaciones familiares durante el verano de 1985 lo cambian todo para un adolescente obsesionado con el ping pong.,"1 horas, 49 minutos",2014,movie
