Name,Description,Duration,Year,Type
Juno,"Cuando Juno (Ellen Page) queda embarazada sin planearlo de su mejor amigo, Bleeker (Michael Cera), la joven poco convencional decide tomar una ruta inusual para encontrar una pareja adecuada de padres adoptivos para criar a su hijo por nacer.","1 horas, 54 minutos",2007,movie
Enfrentando a Alí,"¿Cómo se siente enfrentar al luchador más famoso del mundo? Muhammad Ali, tres veces campeón mundial de peso pesado, derrotó a casi todos los luchadores principales en la edad dorada del boxeo.","1 horas, 59 minutos",2009,movie
La familia Bélier,"En la familia Bélier todo el mundo es sordo, excepto Paula, de 16 años. Ella es esencial para sus padres como intérprete en el día a día, sobre todo para el funcionamiento de la granja de la familia.","2 horas, 3 minutos",2014,movie
12 horas (Gone),"Amanda Seyfried (El precio del mañana, La chica de la capa roja) interpreta este intenso thriller acerca de una joven desesperada que, tras ser ignorada por la policía, debe salir a buscar al asesino serial que ella cree secuestró a su hermana menor.","1 horas, 53 minutos",2012,movie
Locura Por El Tiempo,Un estudiante universitario construye una máquina del tiempo para evitar que su novia rompa con él. Basado en el cortometraje del mismo nombre.,"2 horas, 3 minutos",2018,movie
El tazón del pavo,"Los amigos se reúnen para el Día de Acción de Gracias para terminar el legendario Turkey Bowl, un juego de fútbol que se canceló debido a la nieve hace 15 años.","2 horas, 20 minutos",2019,movie
La Música del Silencio,"Biopic sobre el tenor y músico italiano Andrea Bocelli. A pesar de haber nacido con un grave problema de vista que finalizará en ceguera, Bocelli supera todo tipo de obstáculos, guiado por grandes ambiciones hacia su pasión, la música.","2 horas, 15 minutos",2018,movie
Los Acordes de la Vida,"Kyle lidia con la paternidad en medio de una batalla por la custodia, lo que lo lleva a un viaje de redención y perdón.","1 horas, 45 minutos",2012,movie
Episodio 1,Emergente es un proyecto que se creó de la mano de estudiantes del Tec de Monterrey que busca dar a conocer nuevos talentos de la comedia para ayudarlos a impulsar sus carreras profesionales.,"0 horas, 35 minutos",2023,movie
Episodio 1,Emergente es un proyecto que se creó de la mano de estudiantes del Tec de Monterrey que busca dar a conocer nuevos talentos de la música para ayudarlos a impulsar sus carreras profesionales.,"0 horas, 24 minutos",2023,movie
Persecución Mortal,"El ladrón lleva a cabo el robo de su vida cuando roba al psicótico señor de la droga, Temple. El plan se lleva a cabo sin problemas hasta que el ladrón descubre un polizón en su coche de huida: la esposa embarazada de Temple, Mia.","1 horas, 47 minutos",2022,movie
En el juego del Asesino,"La policía detiene a un psicópata al que se le relaciona con múltiples raptos y asesinatos de mujeres, pero su captura será solo el principio de una cuenta atrás en busca de sus víctimas","1 horas, 56 minutos",2019,movie
Stano,"Después de haber cumplido una pena de prisión de 17 años por un violento error que cometió en su juventud, un exjugador de béisbol regresa a su barrio en el Bronx.","2 horas, 10 minutos",2019,movie
Persiguiendo un Sueño,"La historia de Michelle Payne, la primera mujer jockey en ganar la Copa de Melbourne.","1 horas, 56 minutos",2020,movie
Atrapados,"El desastre del submarino 2000 K-141 Kursk  es seguido por negligencia gubernamental. Mientras los marineros luchan por sobrevivir, sus familias luchan desesperadamente contra obstáculos políticos y obstáculos imposibles para salvarlos.","2 horas, 17 minutos",2019,movie
No apartes la Mirada,"No se mueve, no piensa, simplemente mata. Para una mujer joven, un encuentro casual con esta entidad sobrenatural resulta devastador. Frankie aprende que una vez que vea el maniquí es posible que no haya un final a la vista excepto el suyo propio.","1 horas, 39 minutos",2022,movie
Misión Secreta,Un senador estadounidense es asesinado en Washington por un espía ruso. Un agente de la CIA retirado (Richard Gere) se ve obligado a colaborar con un joven agente del FBI (Topher Grace) para atrapar al criminal.,"1 horas, 56 minutos",2010,movie
El Gran amante,"En la década de 1930, el guitarrista de jazz Emmet Ray idolatra a Django Reinhardt, se enfrenta a gánsteres y se enamora de una mujer muda.","1 horas, 49 minutos",1998,movie
Oculus,"Una mujer intenta exonerar a su hermano, condenado por asesinato, demostrando que el crimen fue cometido por un fenómeno sobrenatural.","2 horas, 1 minutos",2014,movie
Autumn in New York,"Will Keane es el propietario de uno de los restaurantes más famosos y prestigiosos de Nueva York. Su carisma y seguridad le convierten en un imán para las mujeres, con las que se relaciona sin comprometerse.","2 horas, 2 minutos",1999,movie
Henry$ crime,"Henry (Keanu Reeves) sale de la cárcel tras haber cumplido años de condena por un robo que no ha cometido. Una vez fuera de prisión, se plantea la posibilidad de atracar una sucursal bancaria que está situada al lado de un teatro.","2 horas, 7 minutos",2011,movie
Efecto flashback,"En este thriller psicológico protagonizado por Dylan O’Brien (The Maze Runner), Fred protagoniza extraños flashbacks. Tratando de armar este rompecabezas, se embarca en un viaje al pasado a través de las dimensiones de su memoria.","1 horas, 55 minutos",2022,movie
SN. Vincent,"Una extraña unión se forma entre el hijo de 12 años de una madre soltera y su vecino, un misántropo alcohólico.","2 horas, 0 minutos",2015,movie
Amores Inversos,"Johanna, una tímida cuidadora, se ocupa del anciano Mr. McCauley y de Sabitha, su nieta adolescente. Ante una broma cruel de la chica, Johanna reacciona iniciando una extraña relación con Ken, el padre de Sabitha, un adicto en recuperación.","2 horas, 0 minutos",2014,movie
Ojos Grandes,La artista americana Margaret Keane es conocida por sus extravagantes y originales pinturas. Walter Keane es su pareja quien también es artista. Sus obras se convirtieron en uno de los mayores éxitos durante los años 50 y 60.,"2 horas, 6 minutos",1969,movie
Al Otro Lado del Mundo,"Kitty es una joven inglesa de la alta sociedad que, para huir de un ambiente familiar opresivo, se casa con Walter, un prometedor médico. El matrimonio se traslada a Shangai, donde Kitty tiene una aventura con un norteamericano.","2 horas, 27 minutos",2007,movie
El Ilusionista,"En Viena de 1900, Eisenheim cautiva con sus espectáculos de magia e ilusionismo. Sus poderes sobrenaturales llegan a oídos del príncipe heredero Leopold.Sospechando un fraude,Leopold encarga al inspector de policía Uhl que vigile de cerca al mago.","2 horas, 9 minutos",2005,movie
Asesinos de elite,"Un hombre retirado del SEAL, deberá volver a la acción y reunir a su antiguo equipo para enfrentarse a un grupo de soldados renegados que provienen de los grupos militares más temidos del mundo, antes que provoquen un desastre político.","2 horas, 16 minutos",2010,movie
Bus 657: El Escape del Siglo,Un padre no tiene los medios para pagar el tratamiento de su hija. Como último recurso se asocia con un codicioso compañero de trabajo para robar un casino. Cuando las cosas van mal se ven obligados a secuestrar un autobús de la ciudad,"1 horas, 50 minutos",2015,movie
What Just Happened,"Una semana en la vida de Ben, un poderoso productor de Hollywood, mientras hace malabarismos con las negociaciones con un director de estudio para que su última película pueda estrenarse en Cannes en dos semanas.","2 horas, 2 minutos",2008,movie
Una familia peligrosa,Un jefe de la mafia y su familia son trasladados a un pueblo tranquilo en Francia bajo el programa de protección de testigos después de delatar a la mafia.,"2 horas, 11 minutos",2013,movie
American Psycho 2,"La única sobreviviente, Patrick Bateman, se convierte en una profesora asistente mientras desarrolla sus propias obsesiones homicidas y destruye a todos los que se interpongan en su camino después de 15 años del terrorífico evento.","1 horas, 44 minutos",2020,movie
Amor Rebelde,Un grupo de amigos vive en Londres creando arte y disfrutando de un estilo de vida ocioso y acelerado.,"1 horas, 42 minutos",2015,movie
Gunman,Jim Terrier es una espía internacional que ha sido traicionado por la organización para la que trabajaba. Debido a ello decide dejar atrás su antigua vida de agente encubierto para casarse con su novia Annie y mudarse a otro estado.,"2 horas, 15 minutos",1969,movie
Consigue un Trabajo,"Miles Teller, Anna Kendrick y Bryan Cranston protagonizan esta comedia fresca y perversamente divertida sobre conseguir un trabajo en una economía difícil.","1 horas, 38 minutos",2020,movie
El Dador de Recuerdos,Cuenta la historia de un mundo perfecto en el que todos sus habitantes son felices de forma artificial. Los que se encuentran en el poder han eliminado cualquier motivo que pudiera suponer un enfrentamiento o discusión.,"1 horas, 55 minutos",2014,movie
Fantasmas de Guerra,Cinco soldados estadounidenses asignados para ocupar un castillo francés cerca del final de la Segunda Guerra Mundial.,"1 horas, 53 minutos",2020,movie
Lejos de la Tierra Quemada,Los hijos de dos amantes muertos intentan entender lo que les sucedió a sus padres.,"1 horas, 58 minutos",2008,movie
Serena,"En la Carolina del Norte de los Años 20, el futuro del imperio maderero de George Pemberton se complica cuando se casa con Serena.","2 horas, 9 minutos",2015,movie
Conspiración Mortal,Un suceso violento desencadena una serie de eventos trágicos vistos desde diferentes perspectivas en una ciudad de los Estados Unidos.,"1 horas, 54 minutos",2013,movie
Ritmo de un Sueño,"La historia de DJay, un proxeneta cuyo ajetreo vendiendo a la sexy Nola lo deja preguntándose si este es su fin. Solo cuando se encuentra con su viejo compañero de la escuela, Key, encuentra una salida componiendo canciones.","2 horas, 16 minutos",2005,movie
Locos en Brooklyn,"Henry Altmann, enojado como siempre, se despierta con un terrible dolor de cabeza. Una nueva doctora, Sharon Gill, vendrá a verte.","1 horas, 51 minutos",2013,movie
La gran explosión,"Una noche, en Los Ángeles, el investigador privado Ned Cruz (Antonio Banderas) recibe la visita de un boxeador ruso, recientemente puesto en libertad condicional, que le propone un misterioso trabajo: encontrar a Lexie, su novia desaparecida, y diamantes.","1 horas, 59 minutos",2011,movie
Mi Novio es un Ladrón,"Henry Durand es un joven agente federal al que se le asigna una tarea difícil: espiar a su madre y su novio, sospechoso de liderar una banda de ladrones de arte.","1 horas, 55 minutos",2008,movie
The Code,"En Nueva York, el experimentado ladrón de arte, Keith Ripley, invita al audaz ladrón de Miami, Gabriel Martin, a unirse a él.","2 horas, 1 minutos",2009,movie
Cake: Una razón para vivir,"Claire es una mujer que sufre un dolor crónico, y se obsesiona con el suicidio de una compañera de su grupo de terapia, Nina, a la vez que inicia una relación con el viudo de ésta, Roy.","1 horas, 59 minutos",2013,movie
"Santa, qué?","En esta conmovedora historia de Navidad, donde el auténtico Papá Noel (Leslie Nielsen) se cae de su trineo y desarrolla amnesia. Luego se encuentra con un cansado periodista de televisión, quien es su única esperanza para recuperar a tiempo su memoria y poder salvar la fiesta navideña.","1 horas, 50 minutos",2000,movie
Mi Dulce Navidad,"Sadie, una exitosa ejecutiva de marketing, es hija de los dueños de una chocolatería tradicional. Cuando decide pasar la Navidad con su familia, descubre que sus padres planean vender la tienda, poniendo en riesgo su sueño de heredarla algún día.","1 horas, 41 minutos",2019,movie
El árbol de navidad,"Cuando una chica de la gran ciudad (Lacey Chabert) regresa para salvar la granja de árboles de Navidad de su infancia, puede redescubrir más de lo que esperaba, incluido su único amor verdadero.","1 horas, 44 minutos",2020,movie
Una navidad real,"Una ejecutiva de publicidad muy trabajadora, se enamora de un consultor que es un príncipe disfrazado.","1 horas, 44 minutos",2020,movie
So this is Christmas,"A los 18 años, Ashley sale con gente mala, y busca una fuga de la rutina de casa. Pero todo empieza a cambiar cuando uno de los empleados de la familia consigue animarla a hacer una pieza de teatro de Navidad para niños necesitados.","2 horas, 9 minutos",2015,movie
12 Días De Regalos,"Baxter es fotógrafo y ha recibido un premio en metálico. Con él puede pagar la boda con su novia, pero a medida que va surtiendo de regalos a gente necesitada ese dinero merma, y su chica se enfada.","1 horas, 43 minutos",2016,movie
A Song for Christmas,Charlotte es nueva en la ciudad y se da la circunstancia de que su madre ha intimado con el padre de la que parece que se va a convertir en su peor enemiga.,"1 horas, 44 minutos",2016,movie
Las navidades de Pete,Petes Christmas es una película para televisión protagonizada por Zachary Gordon y Bailee Madison. Un niño se encuentra en el centro de atención inesperado cuando se da cuenta de que el terrible día de Navidad de su familia sigue repitiéndose.,"1 horas, 44 minutos",2013,movie
A Christmas Kiss,"La diseñadora de interiores de lujo Priscilla Hall y su asistente Wendy compiten por la atención del novio de Priscilla, miembro de la alta sociedad, mientras decoran su casa para las fiestas.","1 horas, 47 minutos",2010,movie
Mejor Solo Que Mal Acompañado,"Neal quería volar a Chicago para pasar el Día de Acción de Gracias con su familia. Pero solo consigue problemas. Problemas causados por Del Griffith, un vendedor gritón que lleva a Neal en un viaje salvaje.","1 horas, 50 minutos",1986,movie
La Navidad de mi Mejor Amigo,"Durante una visita a su pueblo natal, una mujer se entera de que su ex novio tiene una nueva relación. Entonces, le pide a su mejor amigo que se haga pasar por su novio.","1 horas, 43 minutos",2019,movie
Novios por navidad,"La organizadora de eventos Valeria, traicionada por su amiga Tere que le robó a su prometido, finge un romance con Camilo para vengarse, lo que desemboca en una inesperada historia de amor navideña.","0 horas, 52 minutos",2023,movie
Deliciosa Navidad,"Máximo, chef de cocina molecular, hereda un restaurante dirigido por Luciana, experta en cocina típica. Durante la Navidad, ambos se enfrentan por sus diferentes visiones de la vida, la cocina y el amor, creando una combinación explosiva y deliciosa.","0 horas, 55 minutos",2022,movie
Mi amor en navidad,"Lucas, un famoso cantante cuyo mayor éxito ha sido ""Mi Amor en Navidad"", decide tomarse un descanso, volviendo a su pueblo natal para pasar las fiestas. Allí se reencuentra con Elisa, su primer amor y la inspiración de su éxito navideño.","0 horas, 55 minutos",2023,movie
Una navidad para recordar,"Sebastián, quien odia la Navidad y enfrenta su primer año sin sus hijos después de un divorcio, decide pasar la temporada con su madre Ángela, quien padece de Alzheimer.","0 horas, 55 minutos",2022,movie
Intercambio navideño,"Las gemelas Maya y Ana, separadas al nacer y con vidas totalmente distintas, se descubren e intercambian vidas por una noche, alterando sus destinos para siempre.","0 horas, 56 minutos",2023,movie
La mejor Navidad,"Gloria, enfocada en su trabajo en Miami después de su divorcio, envía a sus hijos a pasar la Navidad con su exmarido en Jalisco. Lo que no imaginan es que esta decisión les va a cambiar la vida.","1 horas, 2 minutos",2022,movie
Un Papá para Navidad,"Rebeca, una estrella de las redes sociales enfocada en la fama, recibe una sorpresa cuando un desconocido, que dice ser su padre, aparece en Navidad.","0 horas, 55 minutos",2022,movie
Juntos esta Navidad,"Luego de una ruptura amorosa, Isabel y el viudo Juan Andrés con su hija comparten, accidentalmente, una cabaña navideña. Circunstancias inusuales y la magia de las fiestas resultarán en una unión muy especial.","0 horas, 53 minutos",2023,movie
Los Fantasmas Contraatacan,"Frank Cross es un cruel ejecutivo de televisión con las cualidades perfectas de un Scrooge de los tiempos modernos. Antes de que termine la noche, lo visitarán tres fantasmas del pasado, el presente y el futuro.","1 horas, 58 minutos",1987,movie
A Christmas Karen,"Karen es una mujer de mediana edad que, debido a su actitud exigente y arrogante, ha alienado a sus amigos y familia. Un día, Karen recibe una visita por parte de unos espíritus no convencionales.","1 horas, 56 minutos",2022,movie
Dear Secret Santa,"Tatyana Ali estelariza en esta película llena de estrellas, incluyendo a Jordin Sparks, Ernie Hudson y Della Reese. ¡Es un reconfortante romance navideño!","1 horas, 46 minutos",1969,movie
Un romance navideño,Dos extraños con mala suerte se unen para tratar de llegar a casa por Navidad.,"1 horas, 59 minutos",2019,movie
Una Navidad de Cuento,"En esta alegre versión del clásico de Dickens, Carol (Tori Spelling) interpreta a una presentadora de programas de televisión egoísta que está decidida a destruir la diversión festiva en el estudio. Por sus acciones, tres espíritus la visitarán.","1 horas, 41 minutos",2003,movie
Salvando Navidad,"Un niño, Danny, intenta demostrar la existencia de Santa usando su inteligencia y sus dispositivos. Él y su grupo de confianza emprenden un intenso viaje para encontrar la verdad de Santa.","1 horas, 44 minutos",2017,movie
La navidad de Jonathan,"Cuando un niño pierde el belén de madera que lo vincula con su padre muerto, su madre preocupada convence a un tallador de madera solitario y malhumorado para crear un reemplazo y permitir que su hijo lo vea trabajar en él","1 horas, 49 minutos",2007,movie
Una Esperanza de Navidad,"Esta es una encantadora y conmovedora historia navideña sobre la esperanza, el perdón y la fe, que cuenta cómo una madre soltera y su única hija de siete años encuentran un Santa Claus que puede cambiar sus vidas.","1 horas, 57 minutos",2019,movie
Bailey: Un héroe de Navidad,"Es ""tiempo de Navidad"" y Bailey preocupado de que no recibirá  regalos porque ha sido un mal perrito, aprende acerca de un misterioso indio nativo americano que puede ser capaz de hacer que sus deseos se hagan realidad.","1 horas, 42 minutos",2012,movie
Christmas With Tucker,"Tras la muerte de su padre, un niño forma un vínculo especial con el perro de un vecino y aprende a ser un hombre ayudando a sus abuelos durante una tormenta invernal.","1 horas, 42 minutos",2012,movie
Una Noche Especial,"Catherine y Robert son unos adultos mayores que nunca pensaron que podían encontrar algo increíble entre ellos. Su encuentro es una noche especial, siendo esto el inicio de una relación para vivir una segunda oportunidad de sentir verdadero amor.","1 horas, 46 minutos",1998,movie
Jessabelle,"Al regresar a su hogar de la infancia en Louisiana para recuperarse de un horrible accidente automovilístico, Jessabelle se encuentra cara a cara con un espíritu atormentado que ha estado esperando su regreso, y no tiene intención de dejarla escapar.","1 horas, 46 minutos",2014,movie
El Chef,"El joven Jacky Bonnot sueña con triunfar en un gran restaurante. Un día se cruza en su camino Alexandre Lagarde, un célebre chef, cuya acomodada posición se ve amenazada por el grupo financiero propietario de sus restaurantes.","1 horas, 40 minutos",2014,movie
Solo los Amantes Sobreviven,"Adam, un músico de Detroit deprimido por el rumbo que ha tomado la sociedad, y la enigmática Eve, que vive en Tánger, son dos vampiros que llevan siglos amándose. La llegada de Ava, la salvaje hermana menor de Eve, pone en peligro su romance.","2 horas, 19 minutos",2013,movie
1911,"La historia se centra en el nacimiento de la República China en 1911, cuando las fuerzas nacionalistas comandadas por Sun Yat-Sen expulsaron a la Dinastía Qing.","1 horas, 57 minutos",1911,movie
Down And Derby,"Mientras un grupo de padres de los suburbios intenta hacerse cargo del concurso derby de madera de pino de sus hijos, todo el vecindario se tambalea al borde de la locura.","1 horas, 46 minutos",2004,movie
Encarcelados,"Rachel, una policía novata, está a punto de empezar su primer turno de noche en la comisaría de policía de un tranquilo pueblo.","1 horas, 50 minutos",2015,movie
Alex Rider: Operación Stormbreaker,"Después de la muerte de su tío, el colegial de 14 años Alex Rider es obligado por la División de Operaciones Especiales del servicio secreto de inteligencia del Reino Unido, MI6, a una misión que salvará millones de vidas.","1 horas, 51 minutos",2005,movie
Bring it on,"Dos equipos de animadoras se enfrentarán para conseguir el gran premio nacional de ""cheerleaders"".","1 horas, 56 minutos",2000,movie
Amor a Segunda Vista,"Alec y Megan, unos jóvenes que rondan los veintitantos años, despiertan juntos después de haber tenido una aventura de una noche. Cuando les sorprende la tormenta de nieve que azota Nueva York, se ven obligados a permanecer juntos.","1 horas, 42 minutos",2014,movie
La Maldición,"En este thriller apasionante y sobrenatural con las estrellas más populares de Hollywood, un temor del estudio crece hasta convertirse en una vertiginosa pesadilla para un profesor y tres sujetos atrapados en una mansión misteriosa.","2 horas, 12 minutos",1999,movie
Magic in the Moonlight,Es una comedia romántica que cuenta la historia de un hombre ingles traido para desenmascarar a una posible estafa. Sobrevienen complicaciones personales y profesionales.,"1 horas, 55 minutos",2014,movie
Pequeños guerreros,"Underdogs cuenta la historia de un grupo de niños a través de sus vidas, desafíos y luchas en las artes marciales y su batalla contra los demás equipos en el Campeonato de Beverly Hills.","1 horas, 52 minutos",2015,movie
Laggies,"La veinteañera Megan, de mentalidad todavía adolescente y asustada ante la proposición de matrimonio de su novio, busca un retiro temporal mientras huye durante una semana con Annika, una joven de 16 años que resulta ser su nueva mejor amiga.","1 horas, 59 minutos",2013,movie
Fire with Fire,"Un bombero fuera de servicio es testigo de un asesinato a manos de una banda de mafiosos. Entra en el programa de protección de testigos hasta que testifique, pero no consigue ocultarse por mucho tiempo de la banda, por lo que decide actuar por su cuenta.","1 horas, 55 minutos",2012,movie
Yo te amo Phillip Morris,Comedia negra que narra la historia de un estafador padre de familia que acaba en prisión donde se enamora de su compañero de celda.,"1 horas, 55 minutos",2008,movie
A walk to remember,"La historia de dos adolescentes de Carolina del Norte, Landon Carter y Jamie Sullivan, que se unen después de que Landon se mete en problemas y está obligado a hacer servicio comunitario.","2 horas, 4 minutos",2002,movie
El Medallón Perdido,"El arqueólogo Dr. Michael Stone buscó el medallón perdido toda su vida, y ahora su hijo Billy se ha hecho cargo de la búsqueda.","1 horas, 56 minutos",2012,movie
Ten cuidado a quien llamas,Seis amigos atraen la atención de una presencia demoníaca durante una sesión en línea y comienzan a notar sucesos extraños en sus hogares.,"1 horas, 6 minutos",2019,movie
Silent Hill: Revelation,"Cuando cumple 18 años, Heather Mason decide buscar a su padre. Las pesadillas que la acechan la conducen a la ciudad de la niebla eterna, donde acabará descubriendo el misterio de Silent Hill.","1 horas, 52 minutos",2012,movie
La Sirenita,El periodista Cam Harrison va a investigar la historia de una sirena. Lleva a su sobrina a esta empresa y los dos son testigos de su actuación en un circo. Cam está enamorado de la sirena y la protege cuando el dueño del circo se enfurece por su fuga.,"1 horas, 41 minutos",2017,movie
Un pedacito de cielo,"Marley (Kate Hudson) es una mujer joven que descubre que se está muriendo de cáncer, pero cuando de forma inesperada se enamora de su médico (Gael García Bernal), la amenaza de caer en el amor es más aterradora que la muerte.","2 horas, 6 minutos",2010,movie
Yo amo a Shakey,"JT O’Neil, con su hija de 10 años, y su devoto perro Shakey se mudan a una pequeña ciudad de Chicago y al no leer la letra pequeña de su contrato de alquiler, JT se ve obligado a tratar de deshacerse de su perro.","2 horas, 0 minutos",2011,movie
Shelby,"Shelby es un perro sin dueño que tiene por costumbre fugarse de la perrera cada vez que tiene la oportunidad. Durante una de sus escapadas conoce a Jake, un niño que sueña con ser un gran mago, y se hacen amigos inseparables.","1 horas, 50 minutos",2020,movie
Chiguagua: el fantasma,"Al heredar una antigua casa de vacaciones, los Fastener se dan cuenta que la perra de sus antepasados, Sophie los persigue. Homer, su golden retriever, se hace amigo de Sophie y descubre que ella solo está buscando una familia a la que amar","1 horas, 38 minutos",2013,movie
Max salva al Mundo,Sean y su perro Max quieren ser detectives pero en su vecindario no sucede nada hasta que desaparece un diamante. Ahora tendrán que enfrentarse a un grupo de alienígenas que vienen al planeta con planes de quemar la Tierra.,"1 horas, 44 minutos",2014,movie
"Benny , El Feo","Es la historia de un perro sin buena apariencia, sus dueños no tenian idea de que hacer con el cachorro extraño. Pero su ternura logro que una familia lo adoptara y desde ese momento la vida de Benny ha cambiado totalmente.","1 horas, 57 minutos",2014,movie
Un amor hasta las patas,"Su amiga Roxana decide conseguirle una cita a través de las redes sociales. El desastre de la cita la lleva a pedirle un deseo a un mágico ""gato de los deseos"": tener un novio tan tierno y comprensible como sus 2 adorables perros.","1 horas, 42 minutos",2018,movie
